,date,username,tweet,hashtags,nlikes,nreplies,nretweets,timezone,place,geo
458,2020-06-05 14:17:47,VanessaVeloz_,Black is .. 🖤 #blm #nojusticenopeace pic.twitter.com/tf21nAQvRr,"['#blm', '#nojusticenopeace']",47,0,14,PDT,,
459,2020-06-05 14:17:43,tootiredtay,"I’d be front row at these protests if I wasn’t pregnant, but Lord knows it’s prob for the best, instead I’ll be at home praying for you all 🙌🏽🙏🏽 #BLM",['#blm'],31,0,1,PDT,,
460,2020-06-05 14:17:42,wearepoweruk,"Here's the first ever #PopNewsWithPerry!

Every week our very own @PerryOBree will roundup the BIGGEST celeb moments YOU need to know about. This week:

🌎 Pop stars across the world support and show solidarity for #BLM
💄 #jadethirlwall's collab with @SkinnydipLondon

& more! pic.twitter.com/2VSZ0Pf7UP","['#popnewswithperry', '#blm', '#jadethirlwall']",28,1,3,PDT,,
461,2020-06-05 14:17:34,jameswebb1987,"Me: There’s not many cops at this protest down Beacon Street #BLM #bostonprotest 

Cops: pic.twitter.com/HO6a7oY7Os","['#blm', '#bostonprotest']",17,2,4,PDT,,
462,2020-06-05 14:17:25,kayleeolguin_,all of my ex’s “friends” who are white and use the n word are real quiet rn #BLM,['#blm'],26,0,1,PDT,,
463,2020-06-05 14:16:41,E_Carlen,"All talk and no action @NYCMayor. 

END THE CURFEW. ALLOW PEOPLE TO PEACEFULLY PROTEST. 

#BlackLivesMatter #BLM #NYCCurfew #NYC https://twitter.com/NYCMayor/status/1269000886203953157 …","['#blacklivesmatter', '#blm', '#nyccurfew', '#nyc']",13,1,0,PDT,,
464,2020-06-05 14:16:41,frenchdeadpizza,WHITE PEOPLE DO NOT GET TO DECIDE HOW BLACK PEOPLE PROTEST FOR #BLM. THANK YOU.,['#blm'],34,0,3,PDT,,
465,2020-06-05 14:15:42,balencigabsia,Hoboken #BLM Protest: We sang for Breonna Taylor’s Birthday today. We will get your justice soon Queen ♥️ #blackwomenlivesmatter pic.twitter.com/FaANlXJzJD,"['#blm', '#blackwomenlivesmatter']",23,0,10,PDT,,
466,2020-06-05 14:15:32,chickenprincess,"#BlackLivesMatter
#BLM
I'm so sorry and I will do everything I can.  pic.twitter.com/HdCb2NL7Di","['#blacklivesmatter', '#blm']",26,1,3,PDT,,
467,2020-06-05 14:15:24,johnharveyphoto,"Bravo, Mayor Bowser!
PS The street signs will need to be under surveillance to protect them from vandalism by racists acting either independently or at Trump's direction.
#BLM #BlackLivesMatter https://twitter.com/Reuters/status/1269006076168384512 …","['#blm', '#blacklivesmatter']",50,3,23,PDT,,
468,2020-06-05 14:15:20,CoachRobKeys,Our Team. Our Voice. More than touchdowns & tackles. #StrongerTogether #1TEAM #BLM  https://twitter.com/UFOilersFB/status/1269009964967833610 …,"['#strongertogether', '#1team', '#blm']",26,0,1,PDT,,
469,2020-06-05 14:15:10,mini_bubbly,White Canadian Trump supporter got his a$$ arrested at the #BLM PROTEST in Canada 🇨🇦🤣🤣🤣  pic.twitter.com/I9SuWUoRHC,['#blm'],185,14,76,PDT,,
470,2020-06-05 14:14:29,Cheese12987,"Remember when the U.S. wanted to bomb Syria over “allegedly” using chemical weapons against it’s own citizens?

Tear gas is a chemical weapon...
#BLM #NoJusticeNoPeace #ChemicalWarfare #PoliceState #America https://twitter.com/bbcease/status/1267582823428501508 …","['#blm', '#nojusticenopeace', '#chemicalwarfare', '#policestate', '#america']",112,9,49,PDT,,
471,2020-06-05 14:14:23,derek_ddavis,"Medics organize and get geared up before the start of the protest in Portland, Maine. #BLM #protest pic.twitter.com/HMlusSGHUf","['#blm', '#protest']",35,1,9,PDT,,
472,2020-06-05 14:12:30,JasonPMcGraw,Bloomington #BlackLivesMatter #BLM  pic.twitter.com/SuxgLT2Rmo,"['#blacklivesmatter', '#blm']",19,0,4,PDT,,
473,2020-06-05 14:12:19,DjASHBA,"Praying for positivity, peace and love for every single one of you in this very difficult time. Much love ~ASH #love #peace #BLM #theabducted #supportoneanother #loveoneanother pic.twitter.com/SKulaTVuky","['#love', '#peace', '#blm', '#theabducted', '#supportoneanother', '#loveoneanother']",318,25,42,PDT,,
474,2020-06-05 14:11:57,mrskellylove,"I'm toggling between this platform and FB and notice a friend who's at a #BLM protest in my little town. I am not there, and can't risk bringing #COVID back to my family. 

So, time to gather resources on what I can do.

And PS my little town is racist","['#blm', '#covid']",11,3,0,PDT,,
475,2020-06-05 14:11:47,SCline001,"That's bullsh*t. 
For God's sake, they stepped over a man who was bleeding out of his ear from police brutality. 
#BLM",['#blm'],55,1,16,PDT,,
476,2020-06-05 14:11:35,sirhottest,Latinos going hard for #blm on the TL but haven't said a word to their racist ass abuelas 😂,['#blm'],188,22,18,PDT,,
477,2020-06-05 14:10:47,AlysaMartinRX,"I am proud everyday to be a resident at URMC, but today I was exceptionally proud.

We held a #WhiteCoatsForBlackLives demonstration today. For 9 minutes, we knelt in silence in honor of George Floyd’s memory. Those 9 minutes felt like an eternity. What a moving experience. #BLM  pic.twitter.com/81nGnTuaFc","['#whitecoatsforblacklives', '#blm']",12,1,3,PDT,,
478,2020-06-05 14:10:03,hollyguise,"I’ve had a lump in my throat all day. Went 2 the DMV this am, wore a mask, got my temperature taken. I’m still stressed about exposure. Stressed about the police brutality I see on videos

Thanks 2 everyone taking to the streets risking Covid exposure to peacefully protest

#BLM",['#blm'],15,0,0,PDT,,
479,2020-06-05 14:10:02,stoneponyclub,"Black Lives Matter 🖤
@springsteen #blacklivesmatter #blackouttuesday #blm #BruceSpringsteen #brucespringsteen #soulmate #soulkissing #clarenceclemons #bigman #staysafeeveryone #stayhome #staystrong #stayhealthy #stayathome #staysafe #staysafestayhome #staysafeandhealthy pic.twitter.com/eMhPqczTTR","['#blacklivesmatter', '#blackouttuesday', '#blm', '#brucespringsteen', '#brucespringsteen', '#soulmate', '#soulkissing', '#clarenceclemons', '#bigman', '#staysafeeveryone', '#stayhome', '#staystrong', '#stayhealthy', '#stayathome', '#staysafe', '#staysafestayhome', '#staysafeandhealthy']",33,1,4,PDT,,
480,2020-06-05 14:09:44,Chopper11Pilot,March towards Liberty Tunnel. #Pittsburgh #Chopper11 @WPXI #BLM  pic.twitter.com/i3L0piykeK,"['#pittsburgh', '#chopper11', '#blm']",48,2,11,PDT,,
481,2020-06-05 14:07:32,PaigeChristieUK,#BLM is not an aesthetic 😒😒😒  pic.twitter.com/xXLQF4k33M,['#blm'],278,29,63,PDT,,
482,2020-06-05 14:07:31,NotTheCollegian,"Hi everybody. @SterlingMOliver here one last time - I have found somebody wanting to take over the account and am currently in the process of passing it over. They're great & kind, and it'll be a blast. Take it easy. 

And please donate to #BLM funds.  http://blacklivesmatters.carrd.co ",['#blm'],18,0,0,PDT,,
483,2020-06-05 14:07:11,JasonDunn16,"It’s a beautiful night in Frankfort for a #BLM rally!  (Staying socially distant, so we’ll see how much I hear)  pic.twitter.com/VJKJPQoBjy",['#blm'],45,2,7,PDT,,
484,2020-06-05 14:07:06,Kmega4,No GRG this week in support of #BLM & all the great people that's supporting in these protests for the right reasons. We feel that's more important then talking about games at this time. Give the week to Mr Floyd and all those who has been victim to Police brutality. 🙏🏾  pic.twitter.com/YBRhco1DMN,['#blm'],65,5,18,PDT,,
485,2020-06-05 14:07:04,AeJordan06,Our Next Generation STANDING STRONG TOGETHER for America to do the right thing because Black Lives Matter!!! @drakereid12 @AEJordan77 @matthew_daines @King_kev42230 @stuckey_jordyn @jrayba_82103 @rochcommschools @BLMLA #BLM  pic.twitter.com/whaQCedIrC,['#blm'],24,0,1,PDT,,
486,2020-06-05 14:06:57,thefamoustv,"That’s paint, that’s DC, that’s the White House. #blm  pic.twitter.com/PQXNtCCo3F",['#blm'],36,5,6,PDT,,
487,2020-06-05 14:06:38,dbrown3137,"So awesome to see all the young adults and children out for the #BLM protest in Huntley, IL.  #Huntley pic.twitter.com/tfYb828fGm","['#blm', '#huntley']",132,0,34,PDT,,
488,2020-06-05 14:06:24,CoachRobKeys,Our Team. Our Voice. More than touchdowns & tackles. #StrongerTogether #1TEAM #BLM,"['#strongertogether', '#1team', '#blm']",30,1,3,PDT,,
489,2020-06-05 14:06:11,TheQueenChioma,"Ima need black ppl to STOP looking for famous black musicians and influencers to lead #BLM advocacy. Most of these rappers are colorist and we’re NEVER here for black unity amongst BW AND BM, & a lot of the IG girls dgaf about anything but insecure BW feeding their pockets. 1/2",['#blm'],47,2,8,PDT,,
490,2020-06-05 14:05:47,JamesSteamz,"Feel ashamed I’ve not done a single thing for the #BlackLivesMatter movement yet, been feeling quite low this week but feeling better now, so tomorrow I’m gonna get my arse in gear and sign the shit out of a million petitions, donate to the cause, email my MP, etc. MON 💪💪#BLM","['#blacklivesmatter', '#blm']",13,3,0,PDT,,
491,2020-06-05 14:05:46,alihaljarrah,"NEW FLYER WITH NEW TIME ANOTHER LOCATION! 

WE’RE MARCHING TO ALL THREE POLICE DEPARTMENTS! 

#PVBLM #BLM 

Shout out to Gab for the amazing flyer! 

@senatorselman @gabfariaa @zairacap pic.twitter.com/gyriGELZys","['#pvblm', '#blm']",27,0,33,PDT,,
492,2020-06-05 14:05:28,stfu_Jazz,YOU CANT PUT A CURFEW ON THE CITY THAT NEVER SLEEPS! #BLM  pic.twitter.com/tY3SIAz04b – at Borough Hall Steps,['#blm'],34,0,2,PDT,Borough Hall Steps,
493,2020-06-05 14:03:35,iHasCupquake,White privilege is real. Rascim is real. We need to stay strong and keep fighting for a change. #BLM  https://twitter.com/Satellit3Heart/status/1268863536299675648 …,['#blm'],550,10,98,PDT,,
494,2020-06-05 14:03:14,slewisimpson,"My tweet about nothing. Went swimming next to this this evening, carefully. An eagle flew overhead. It was good to stop to listen. I wish you all peace. #nlwx #BLM  pic.twitter.com/7nc3lqz4L2","['#nlwx', '#blm']",70,6,1,PDT,,
495,2020-06-05 14:02:15,SpeciationLab,#BLM Bloomington  pic.twitter.com/MMsaiDQLRq,['#blm'],13,0,0,PDT,,
496,2020-06-05 14:01:59,MYSTIC7,"As individuals, it's the times in our lives that are full of chaos and emotion that we learn the most about ourselves and grow the most from.

These chaotic and emotional times in society are no different. We're all learning and growing so much towards a positive direction. #BLM",['#blm'],358,7,35,PDT,,
497,2020-06-05 14:01:56,slyestial,"I've been working on a google doc with a master-list of a BUNCH of FREE petitions that you can sign, info, donation pages, etc. I'm continuing to update it as we speak, but I've already listed a TON of petitions ready to sign. :)
#blacklifematters #BLM
 https://docs.google.com/document/d/11tPFeT2viHyVfNjDLd4hntzWksteQaOT1fDWWuXmYEU/edit?usp=sharing …","['#blacklifematters', '#blm']",214,6,241,PDT,,
498,2020-06-05 14:01:44,visionconsultla,"Thank you @ozzie_martinez @BarbaraCarnesMD and @x_margie for your leadership at @KPSouthBay . Much more to do to change the systems and structures that have led to the deaths of #GeorgeFloyd, Eric Garner, Tamir Rice and so many others, as well as #health and income gaps. #BLM  https://twitter.com/ozzie_martinez/status/1269000509274198016 …","['#georgefloyd', '#health', '#blm']",13,0,2,PDT,,
499,2020-06-05 14:01:00,BrittanyBadeTV,"From a Pastor in NM on those saying 'All lives matter'- ""Jesus in Luke 15: 100 sheep, but one goes missing. Jesus leaves the 99 to go after the one. The 99 say: ""But, what about us? Don't we matter?"" Of course the 99 matter, but they're not the ones in danger. The one is."" #BLM",['#blm'],42,5,7,PDT,,
500,2020-06-05 14:00:39,mimimd83,"We see you. We hear you. We stand with you. 🙏🏽
#WhiteCoatsForBlackLives #AsiansForBlackLives #BLM  pic.twitter.com/TxATLqiTct – at Kaiser Permanente Medical Building 1 - Anaheim,  CA","['#whitecoatsforblacklives', '#asiansforblacklives', '#blm']",60,2,12,PDT,"Kaiser Permanente Medical Building 1 - Anaheim,  CA",
501,2020-06-05 14:00:36,sirhottest,"If you posted #blm, but haven't heard of the name Darren Seals, please do your Googles.",['#blm'],45,10,17,PDT,,
502,2020-06-05 14:00:24,alexandriajaee,"I would like to reiterate this movement and this work is not about me or about ASU, it’s about ALL BLACK PEOPLE demanding upheaval of the racist police system. Don’t get it twisted! #blm #GeorgeFloyd #BreonnaTaylor #TonyMcDade #SeanReed #AhmaudArbery","['#blm', '#georgefloyd', '#breonnataylor', '#tonymcdade', '#seanreed', '#ahmaudarbery']",48,1,12,PDT,,
503,2020-06-05 14:00:06,MADEMOBB,We at MADE MOBB have always stood for diversity and community. We stand strong with our brothers and sisters. New window display at our crossroads art district location. DM us your photos if you take any near this or our Nipsey mural. Thank you Kansas City #BLM  pic.twitter.com/9yImedN5PS,['#blm'],15,0,7,PDT,,
504,2020-06-05 14:00:03,tyus_millhollin,PUT YOURSELF IN OTHER PEOPLES SHOES BEFORE YOU BLATANTLY SPEAK ON THEM AND WHAT THEY GO THROUGH!!! HAVE SOME DECENCY DURING THIS TIME PLEASE!!!!!!!! #BLM #DoBetter 🙏🏿🙏🏾🙏🏽🙏🏼🙏🏻🖤,"['#blm', '#dobetter']",22,0,5,PDT,,
505,2020-06-05 14:00:01,byron_auguste,We wish health and strength to all those working to achieve racial and economic justice. @OpptyatWork #BLM  https://twitter.com/OpptyatWork/status/1268961275415052289 …,['#blm'],19,0,7,PDT,,
506,2020-06-05 13:59:42,David_Leavitt,Live in Providence #blm #blacklivesmatter #protest #providence https://www.pscp.tv/w/calYPjk3ODA1NzB8MURYeHllV2pSa2t4TUrIDa8n7kmxawPUwq2YlGfVqc5vcWvM6D7K7FJgq93V …,"['#blm', '#blacklivesmatter', '#protest', '#providence']",80,6,36,PDT,,
507,2020-06-05 13:59:37,paddybrendan,Native Lives Matter. #BLM,['#blm'],17,1,4,PDT,,
508,2020-06-05 13:58:59,ComfortAndAdam,"Auctioning off a #Commission for the #ComicWritersChallenge to help #BLM - whatever you want (within reason ;) #DigitalArt or done in @CopicOfficialUS bid in the comments! PLEASE RT everyone, we really want to help ♥️

Thank you to @GailSimone starting this pic.twitter.com/faUflJ7rFR","['#commission', '#comicwriterschallenge', '#blm', '#digitalart']",62,15,33,PDT,,
509,2020-06-05 13:58:44,adultent_,"“Banned” tees are available online,w 100% of proceeds being directly donated to the Colorado Freedom Fund.

Every Fucking Penny.

Donate through our site & we’ll match your pledge as well.

We’ll also donate $5 for every retweet on this through the weekend.

Share!!

#BLM 

Æ® ✊🏿  pic.twitter.com/7Bk8pEmF10",['#blm'],19,0,21,PDT,,
510,2020-06-05 13:58:39,PatriotJackiB,"Amazingly, you can see #GeorgeFloyd’s death was a senseless tragedy, support the Black protesters, but not #BLM & #Antifa anarchists, rioters and looters, and support LEOs, the vast majority of whom risk their lives for our safety. #AllLivesMatter pic.twitter.com/c3wXUiP4nX","['#georgefloyd', '#blm', '#antifa', '#alllivesmatter']",41,5,55,PDT,,
511,2020-06-05 13:58:27,artbyatlas0,"Hey I’m Eli aka Atlas; been doing the #indiecomic circuit over a decade, raising nearly $20k in funds on several projects and doing work for SADA Systems/Microsoft, Fantasy Flight Games & others. #Kickstarter for @Shaka_Comic:  http://kck.st/2To7Tlj 
#drawingwhileblack #BLM  pic.twitter.com/ZeKlHIxsWe","['#indiecomic', '#kickstarter', '#drawingwhileblack', '#blm']",38,1,14,PDT,,
512,2020-06-05 13:58:17,DavidJFielding,"Like many of you, I want to retreat into a better headspace. But we can't - we really can't. We have to solve this ourselves.
We don't have armored/spandex heroes who will fight for us. We fight for us. There is a slogan we can get behind though:
Together we are more.
#BLM  https://twitter.com/DavidJFielding/status/1269004422878834688 …",['#blm'],26,0,5,PDT,,
513,2020-06-05 13:58:10,hxleigh__,White coats for Black lives #blacklivesmatter #blm  pic.twitter.com/cARcUVX6uV,"['#blacklivesmatter', '#blm']",32,0,3,PDT,,
514,2020-06-05 13:57:55,stefdagz,"white ppl posting 14 paragraphs like 

""hello, i am here to bravely denounce racism. after 24 years of  nothing bad ever happening to me, i wish to amplify black voices while continuing to make this about myself. as an empath, u can imagine how hard this is on me. #blm thank u.""",['#blm'],21,0,3,PDT,,
515,2020-06-05 13:57:50,suzielawrence,Pittsburgh is telling the truth #BLM  pic.twitter.com/NoRZK4Y3dM,['#blm'],22,0,3,PDT,,
516,2020-06-05 13:57:13,cheungspy,"So when BLM protestors call for cops to quit their jobs, they won't do it, but when their bros start getting consequences (the bare minimum) for their actions, they are LINING UP to resign. COOL. Keep doing what you're doing yall. #BLM #JusticeForBreonna #BreonnaTaylor","['#blm', '#justiceforbreonna', '#breonnataylor']",1095,5,134,PDT,,
517,2020-06-05 13:57:13,JustTraveI,"Today, the #BLM movement has been declared the biggest civil rights movement in history, with protests reaching all 50 states and 18 different countries.

Today, we challenge you to spread love, not hate.

Tag a friend or even a stranger and let them know you stand with them!  pic.twitter.com/aYvypH5eB3",['#blm'],57,0,25,PDT,,
518,2020-06-05 13:56:39,_ajawilson22,Happy Birthday #BreonnaTaylor !! Babygirl we will not stop fighting for you 🙏🏽💕💞 #NoJusticeNoPeace #BLM,"['#breonnataylor', '#nojusticenopeace', '#blm']",417,1,57,PDT,,
519,2020-06-05 13:56:37,derek_ddavis,"A woman gives out free masks and hand sanitizer at the protest at Lincoln Park in Portland, Maine. #BLM #protest pic.twitter.com/GuHOscutd4","['#blm', '#protest']",68,3,18,PDT,,
520,2020-06-05 13:56:34,StephDyhrberg,I’ve been asking for the past 2 years what it would finally take for Americans to riot in the streets. I guess now we know. #BLM #VoteTrumpOut2020,"['#blm', '#votetrumpout2020']",11,0,0,PDT,,
521,2020-06-05 13:56:33,ManuZingar,"The ""just a few bad apples"" narrative is rapidly turning into an ""entire industrial scale orchard of putrid and rotted apples.""

The barbarism, brutality, sadism and sociopathic nature of police officers has been exposed. This is who they are, for their actions betray them. #BLM",['#blm'],97,3,13,PDT,,
522,2020-06-05 13:55:46,FordDawe,The #BLM protests resulted in these black people being murdered:  pic.twitter.com/rDRgnNif4H,['#blm'],42,1,7,PDT,,
523,2020-06-05 13:55:27,UFOilersFB,"Our Team, Our Voice.... ⬇️#StrongerTogether #1TEAM #BLM
 https://youtu.be/LVrL0_MnXcs  pic.twitter.com/WwipvaalIM","['#strongertogether', '#1team', '#blm']",367,7,162,PDT,,
524,2020-06-05 13:55:23,EEllisThomas,"Great turnout for the #Hoboken protests today. After marching, I ended up at the church to hand out water with our youngest anti-racist activists. #BLM #GeorgeFloyd #BreonnaTaylorBirthday pic.twitter.com/QeMRoq2b2o","['#hoboken', '#blm', '#georgefloyd', '#breonnataylorbirthday']",25,0,5,PDT,,
525,2020-06-05 13:55:21,ReeseJohnson21,"Raising money through our tips at Minnesnowii today in Burnsville Center parking lot, for black mothers in danger of being evicted! 🍧

All tips DONATED

Virtually tip on Venmo: Reese-Johnson-21

#BLM #BlackMothersMatter","['#blm', '#blackmothersmatter']",13,1,5,PDT,,
526,2020-06-05 13:54:37,Iostfocus,"‼️ i will be muting this tweet! BUT i will continue to add more petitions as time goes on. if there is a petition that isn't on here, please DM it to me! #BLM ‼️",['#blm'],95,1,10,PDT,,
527,2020-06-05 13:53:56,meganaff,"after making sick and insensitive comments online, Dalauna from high school (idk how to spell her name) DMd me to watch the 13th. she changed my life 😪 and i believe this movie has the power to change perspective for others. White folk need to watch the 13TH. #BLM",['#blm'],20,4,4,PDT,,
528,2020-06-05 13:53:46,DaveAnki,"It’s nothing new at this point. Been protesting #BLM for almost 10 years. How much longer will it take?
#WhiteCoatsForBlackLives pic.twitter.com/P2PGf3iBk1","['#blm', '#whitecoatsforblacklives']",22,0,4,PDT,,
529,2020-06-05 13:53:26,aashleysanjose,"Handing Out Free water and snacks in front of Wilson Park.
Thank you to those that are Protesting.
Be safe ❤️ #BLM  pic.twitter.com/EVckZAAKrV",['#blm'],19,0,11,PDT,,
530,2020-06-05 13:53:20,SmunchyGames,"This is a matter that shouldn't be political at all. I don't see this as politics. 

This is about human lives and people that are dying. People that are having to use white people to shield them from police and their abuse of power. 

#BlackLivesMatter #BLM  pic.twitter.com/lMlfr42V2D","['#blacklivesmatter', '#blm']",44,3,18,PDT,,
531,2020-06-05 13:53:07,xxxembroidery,"Introducing The Dick Print! This coloring book is filled with even more drawings, a new look, and a lot of nudity; this can be yours for $23. 30% of the proceeds will be donated to a #blm relief fund closest to you, or by your choosing.  pic.twitter.com/d5fHSAvUhM",['#blm'],31,2,8,PDT,,
532,2020-06-05 13:52:58,Ja_M12,"Work by me, Inspired by @denanguyencom 💛 With everything going on it is hard for me to keep quiet and it is even harder to put how I feel in words that can resinate with in people who simply do not understand. Full break down of my image on IG #blm ✊🏽✊🏾✊🏿  pic.twitter.com/B9LjY97Tdo",['#blm'],14,0,8,PDT,,
533,2020-06-05 13:52:45,kathygriffin,"57 Buffalo cops resigned IN SUPPORT of the cops who’ve been caught on tape committing police brutality? 
1) These cops know, resigning from the Buffalo PD “emergency rapid response team” is not resigning from the PD.
2) HAVE All 57 of you resigned from the #BuffaloPD yet? #BLM  https://twitter.com/WBFO/status/1268984006110064641 …","['#buffalopd', '#blm']",4618,349,1216,PDT,,
534,2020-06-05 13:51:52,RealSarahIdan,"So @keithellison proved that his sponsors the Muslim brotherhood is definitely behind #Antifa 

I told you before, #MuslimBrotherhood role is to destabilize countries from within to bring down governments! we seen in Arab Spring, In Egypt, Yemen etc.. 
#GeorgeFloydprotest #BLM  pic.twitter.com/ltSc1OZEEz","['#antifa', '#muslimbrotherhood', '#georgefloydprotest', '#blm']",35,7,15,PDT,,
535,2020-06-05 13:51:42,paricruz,Marchers took a moment to recognize #BreonnaTaylor on her birthday by honoring her memory and singing a song up to the heavens for her. #BLM #BlackLivesMatter #Milwaukee #Protests #SayHerName pic.twitter.com/94JjSrfgZd,"['#breonnataylor', '#blm', '#blacklivesmatter', '#milwaukee', '#protests', '#sayhername']",29,3,11,PDT,,
536,2020-06-05 13:51:42,actuallyjusting,The people of Washington DC have something to say. #blm  pic.twitter.com/icuWN2Snkr,['#blm'],145,1,32,PDT,,
537,2020-06-05 13:51:05,joelygabs,Pretty proud of my city for this. Nice job DC gov.. #BlackLivesMatterDC #blacklivesmatter #BLM #BLMprotest pic.twitter.com/OjTsiiZPL0,"['#blacklivesmatterdc', '#blacklivesmatter', '#blm', '#blmprotest']",10,1,2,PDT,,
538,2020-06-05 13:51:05,subvoyeur,"Praying for Canadian protests/demonstrations to remain peaceful. We shall overcome, together 
✊🏽✊🏾✊🏼 #BLMToronto #BLM","['#blmtoronto', '#blm']",57,4,6,PDT,,
539,2020-06-05 13:50:28,38chuchu_,no more silence.🦋 #BLM #SayTheirNames pic.twitter.com/Hz4oVduyyu,"['#blm', '#saytheirnames']",24,1,4,PDT,,
540,2020-06-05 13:50:22,David_Leavitt,Live in Providence #blm #blacklivesmatter #protest #providence https://www.pscp.tv/w/calWDjk3ODA1NzB8MUx5eEJOWG5MUnl4Thqsefl_ssw4Oo1MR33-xxbL1UwJpwLTJREeo46mqdO_ …,"['#blm', '#blacklivesmatter', '#protest', '#providence']",88,6,27,PDT,,
541,2020-06-05 13:49:54,fritzy,#BLM is super important; the violence that police are bringing to protests is disgusting. It's keeping me up at night and destroying my focus in the day. I have been obsessively watching and researching. I'm not saying much because I know enough to know that I don't know shit.,['#blm'],12,2,1,PDT,,
542,2020-06-05 13:49:32,wizkarlifa_,"✊✊🏻✊🏼✊🏽✊🏾✊🏿
❤️🧡💛💚💙💜
Shoutout to the basshead in Nashville who handed me this during the protest
#LoveOneAnotherLikeSisterAndBrother #BLM  pic.twitter.com/udR5NxdgxX","['#loveoneanotherlikesisterandbrother', '#blm']",59,1,11,PDT,,
543,2020-06-05 13:49:10,PaulAleksandr,I hope all #BLM supporters apply their anti-racism to the likes of Jeffree Star and Alexis Stone and their rich histories of racism. Or does coolness and celebrity excuse that..?,['#blm'],78,2,17,PDT,,
544,2020-06-05 13:49:10,pharmacojo,Atlanta singing happy birthday to Breonna Taylor #Atlanta #AtlantaProtest #BLM  pic.twitter.com/RTWhIRPgn0,"['#atlanta', '#atlantaprotest', '#blm']",41,0,14,PDT,,
545,2020-06-05 13:48:10,StellaChuuuuu,I just found out about Tiltify 3 minutes ago. It allows streamers to fundraise for charities without needing to be a middle man themselves. But the list of #BLM charities is so short???? I think I need help asking charities to be added to their list.  https://causes.tiltify.com/ ,['#blm'],84,5,16,PDT,,
546,2020-06-05 13:47:35,ohthatsantho,4 a better Tomorrow #BLM  pic.twitter.com/eGibsbcEj1,['#blm'],32,0,16,PDT,,
547,2020-06-05 13:47:02,Laurenpresists,This sign is AWESOME!!!!! #BlackLivesMatter #BLM  pic.twitter.com/z2fURdL77u,"['#blacklivesmatter', '#blm']",23,1,9,PDT,,
548,2020-06-05 13:47:01,RIPAINTERSUNION,There should not be military vehicles & soldiers in the streets Providence before peaceful demonstrations. We stand with the demonstrators. #BLM #blacklivesmatter #blacklifematters pic.twitter.com/t2lgKS5DpO,"['#blm', '#blacklivesmatter', '#blacklifematters']",22,0,1,PDT,,
549,2020-06-05 13:46:50,caseylalla,Some statement pieces I’ve been working on! All lives can’t matter until black lives matter. #blm  pic.twitter.com/On4vcFj3yp,['#blm'],28,2,14,PDT,,
550,2020-06-05 13:46:44,OmariMaulana,Thankful for the opportunity! #BLM #TACOMA https://twitter.com/manley_tnt/status/1268986838292656128 …,"['#blm', '#tacoma']",44,3,6,PDT,,
551,2020-06-05 13:46:39,Natalie_Whitt,"Thank you to everyone for all the monetary donations! @k_saddd and I raised nearly 900 dollars. We were able to buy around 550 dollars in groceries/toiletries/supplies and then on our last trip, they told us they were in need of gift cards. You all are awesome! ❤️ #BLM  pic.twitter.com/S2Sx9REvLy",['#blm'],46,0,4,PDT,,
