,date,username,tweet,hashtags,nlikes,nreplies,nretweets,timezone,place,geo
909,2020-06-05 11:34:22,ftoscanomd,@MontefioreNYC Wakefield Campus for Black Lives Matter! #BLM  pic.twitter.com/aTQNmIy9NX,['#blm'],19,0,5,PDT,,
910,2020-06-05 11:34:06,MsYGamingGG,Us here at MsY Gaming support #BLM and will be supporting the unity and equality that is deserved. We just ask do not resort to violence make sure you protest peacefully. Your voice is finally being heard and we will do what we can to help. #MsYOnTop ✊🏿✊🏾✊🏽✊🏼✊🏻✊,"['#blm', '#msyontop']",18,1,9,PDT,,
911,2020-06-05 11:33:44,drawboy,"No new art from me this week, instead Black-Owned Bookstores That You Can Support #Colour_Collective #Pistachio Green #BLM #BlackLivesMatterWorldwide pic.twitter.com/tTjATwfZIK","['#colour_collective', '#pistachio', '#blm', '#blacklivesmatterworldwide']",16,0,4,PDT,,
912,2020-06-05 11:33:30,jonah_andreatta,"the US legalized gay marriage on my 18th birthday. for my 23rd birthday, I would like to see them defund and abolish the police. 

anyway happy pride month and remember that gay rights would be non existent were it not for black trans women leading the charge 50 years ago #blm",['#blm'],47,0,4,PDT,,
913,2020-06-05 11:32:38,PaigeChristieUK,Ok Bach we see you. ✊🏾 #BLM  https://twitter.com/KingBach/status/1268629932097155072 …,['#blm'],43,0,7,PDT,,
914,2020-06-05 11:32:08,ToeKneeSam,"Canceling a comedy show during a pivotal moment in the fight for basic Human Rights and #blm isn’t a sign of weakness, it’s a sign of compassion and not being tone deaf. The world can wait a few days to hear your hot take on dating and farts. #dontbetonedeaf #readtheroom","['#blm', '#dontbetonedeaf', '#readtheroom']",13,1,0,PDT,,
915,2020-06-05 11:32:04,ShartimusPrime,"Posting a black square isn’t enough, we gotta get out there! For the record, NOT me and @sharlitaone ‘s first #BLM protest. First was 2014, so if you think I changed, you just didn’t know me. #blacklivesmatter…  https://www.instagram.com/p/CBEEXn6l97u/?igshid=1xid6u9uus2jc …","['#blm', '#blacklivesmatter']",38,1,2,PDT,,
916,2020-06-05 11:31:54,GeekBomb,"We’ll be donating the entire June profits (roughly $1k) to #BLM causes. 

First: $500 will be donated to the #BreonnaTaylor GoFundMe to help fight her injustice #SayHerName 

$50 was donated to @MNFreedomFund 

$145 was donated to  http://BlackLivesMatters.carrd.co  (thanks @mhysachan)","['#blm', '#breonnataylor', '#sayhername']",23,1,5,PDT,,
917,2020-06-05 11:31:21,YunalesckaGames,"My money lately has been going to these amazing shops. I’ve been buying molds, clothing, and accessories from all the talented shops owned by black women/men. I’ll be making these #BLM shakers/pendants once I get the molds and selling them for charity. Much love. 💕  pic.twitter.com/wOeUh7ddhq",['#blm'],47,4,5,PDT,,
918,2020-06-05 11:30:48,TravRobertson,Citizens using the constitutional right of assembly. Peacefully. #BLM #GeorgeFloyd pic.twitter.com/Tp8JLOHm28,"['#blm', '#georgefloyd']",25,0,7,PDT,,
919,2020-06-05 11:30:44,UofUSurgery,"Members from @UofUHealth Department of Surgery join health professionals around the world to honor #GeorgeFloyd for 8 minutes and 46 seconds.  
#WhiteCoatsForBlackLives #BlackLivesMatter #BLM #JusticeForGeorgeFloyd #RacialJustice pic.twitter.com/Rx0hPOQLCd","['#georgefloyd', '#whitecoatsforblacklives', '#blacklivesmatter', '#blm', '#justiceforgeorgefloyd', '#racialjustice']",117,0,25,PDT,,
920,2020-06-05 11:30:34,MidnightPursona,Since we're highlighting Black Owned Business I wanna share my Mama! Shes been working so hard her whole life and finally found her career in Keto Baking! She makes SUCH GOOD treats for people who wanna do a Keto Lifestyle and still want sweets! @Faith4KetoKitch is amazing! #BLM  pic.twitter.com/egh6Wgnmpd,['#blm'],157,3,112,PDT,,
921,2020-06-05 11:30:33,oliviawildin,"This is a porn account. 18+ to follow. 
if you have no plan on supporting sex workers unfollow. 
I will also continue to fight for #BLM but this account is not strictly an activist account.",['#blm'],13,1,1,PDT,,
922,2020-06-05 11:30:20,bropenhauer,"Some photos I took at the last few #orlandoprotests. It was a mosaic of pain and hope, anger and love. We have a duty to one another, please get involved however you can #BLM  pic.twitter.com/krFEJGkftG","['#orlandoprotests', '#blm']",44,1,9,PDT,,
923,2020-06-05 11:30:12,DanHF,So many people showed up for an anti-racist protest in Utrecht that the city is now calling on people to stay home and watch it on local TV. Wow!! 🙏🌏👏👏👏✊🏿 #BLM #BlackLivesMatterNL https://twitter.com/GemeenteUtrecht/status/1268950251274211328 …,"['#blm', '#blacklivesmatternl']",21,1,3,PDT,,
924,2020-06-05 11:30:03,_Gneisha,"My small, very white, very conservative city had a planned #BLM march today with a turn out of over 2000 people! I could not be more proud, honestly. I didn't expect anything like that from this area.",['#blm'],16,1,0,PDT,,
925,2020-06-05 11:29:59,hoodarchitect,Happening live in #southcentral a community clean up in commemoration of the 1965 & 1992 civil unrest and in solidarity with the current #blm movement  pic.twitter.com/44kzUZ9w4J – at Ralphs,"['#southcentral', '#blm']",56,1,19,PDT,Ralphs,
926,2020-06-05 11:29:13,bonviemofo,White folks dying on the front lines bruh. #AllLivesMatter is extremely silent. #BLM got you.,"['#alllivesmatter', '#blm']",87,1,8,PDT,,
927,2020-06-05 11:29:10,SeanTutton,"I pledge to listen, learn, and confront #racism as well as my own unconscious biases and be an active voice for #equality #RacialEquity I tag @FFacchini33 @IR_Nutt @KMSchramm @rkryu @paragpatel_IR #blm  https://twitter.com/keithppereira/status/1268968138890268677 …","['#racism', '#equality', '#racialequity', '#blm']",21,0,1,PDT,,
928,2020-06-05 11:28:46,korinne_mn,"Thank you to the supporters outside of MPLS who have sent monetary donations so we could deliver medical supplies, household supplies, and food to donation sites. Forever grateful 💜 #BLM #JusticeForGeorgeFloyd #NoJusticeNoPeace","['#blm', '#justiceforgeorgefloyd', '#nojusticenopeace']",22,3,3,PDT,,
929,2020-06-05 11:28:38,EatsKasama,"In solidarity with Black Folks in LA we are again offering Vegan Filipinx comfort food, FREE of charge. Sunday June 7 from 12-4. Limited supplies, priority given to Black single parents, Black Disabled and Black Queer/Trans folks! See google form in bio to reserve a plate. #BLM",['#blm'],19,0,19,PDT,,
930,2020-06-05 11:28:35,platinumjohnell,"2016 vs 2020 
Its sad to say after four years I had to bring out my sign... But I will say this, I will continue to bring that sign march after march, year after year until we see the FULL JUSTICE for all black lives. Same sign same energy 4 ever #BLM #BLACKLIVESMATTER ❤️✊🏽 pic.twitter.com/DearSUQpAb","['#blm', '#blacklivesmatter']",58,0,15,PDT,,
931,2020-06-05 11:28:23,calistaedgar,"every single one of my (older) family members are trying to convince me that all this is “too much” meaning the riots nd lemme tell you, i’m putting them in their place, privileged ass mindset. #blm #iwillstandbyyou","['#blm', '#iwillstandbyyou']",99,2,19,PDT,,
932,2020-06-05 11:27:59,cathynewman,"Lord Woolley of @OpBlackVote tells me he’ll be in @10DowningStreet on Monday “demanding” - not asking - for action on entrenched racism in UK, amid accusations the official inquiry into #BAME #coronavirusuk impact is a whitewash #blm","['#bame', '#coronavirusuk', '#blm']",193,15,46,PDT,,
933,2020-06-05 11:27:22,drtinamaster,"A movement, not just a moment. #whitecoatsforblacklives #blacklivesmatter #blm #whitecoats4blacklives @ChildrensPhila @PennMedicine pic.twitter.com/dqUoFnk5NC – at Franklin Field","['#whitecoatsforblacklives', '#blacklivesmatter', '#blm', '#whitecoats4blacklives']",49,0,5,PDT,Franklin Field,
934,2020-06-05 11:27:08,ainemackenisme,Wifey and I wrote about upgrading yourself from being an #ally to being an #accomplice for @GCNmag #BLM #BlackLivesMatter #enddirectprovision #bekind https://gcn.ie/hello-white-irish-person-upgrade-ally-accomplice/ …,"['#ally', '#accomplice', '#blm', '#blacklivesmatter', '#enddirectprovision', '#bekind']",145,10,45,PDT,,
935,2020-06-05 11:25:47,reltnamai,"please do what you can to help out 
#BLM
 https://linktr.ee/NationalResourcesList …",['#blm'],191,4,73,PDT,,
936,2020-06-05 11:24:48,seanlacey,"He called on us to be the good samaritan, he called on us to leave the 99 to find the one lost sheep. 

Why do we think we are not called to help our brothers and sisters that are marginalized, that are brutalized, that are terrorized? #BLM",['#blm'],47,0,5,PDT,,
937,2020-06-05 11:24:40,abc7chriscristi,"VENICE BEACH, CA - Hundreds chanting ”I can’t breathe!” #GeorgeFloyd #blm @ABC7 #abc7eyewitness pic.twitter.com/IzwQ8aBLag – at Venice Beach","['#georgefloyd', '#blm', '#abc7eyewitness']",96,3,33,PDT,Venice Beach,
938,2020-06-05 11:24:34,bootsisawstr,We're raffling off loads of @wstrband memorabilia for #BLM! Please check this out and join in if you can. RT! x✌️  https://twitter.com/wstrband/status/1268967003504742401 …,['#blm'],54,1,7,PDT,,
939,2020-06-05 11:24:11,GarnikathePanda,"Let's see how low we can get my follower count 🤙

I'll stop posting about #BLM when black people and peaceful protestors stop dying at the hands of police and white nationalists.",['#blm'],54,2,7,PDT,,
940,2020-06-05 11:24:11,IndpndntShef,"Compiling a list of black-owned independent venues in #Sheffield

Who should be mentioned?

#BLM #Sheffieldissuper pic.twitter.com/FdMZpzgIge","['#sheffield', '#blm', '#sheffieldissuper']",12,1,10,PDT,,
941,2020-06-05 11:22:52,Tionna_q,"If you don’t support me with this... you don’t support me with that! If you’re not fighting for a solution, you’re part of the problem #MoreThanJustAnAthlete #BLM ✊🏽🖤  pic.twitter.com/laoE5b3pq8","['#morethanjustanathlete', '#blm']",1054,13,81,PDT,,
942,2020-06-05 11:22:35,wxyzdetroit,#BLM #GeorgeFloydMemorial #MacombCountyProtest Stretch of Hall Road in Macomb Co. closed Saturday for march https://www.wxyz.com/news/stretch-of-hall-road-in-macomb-co-closed-saturday-for-march …,"['#blm', '#georgefloydmemorial', '#macombcountyprotest']",40,18,22,PDT,,
943,2020-06-05 11:21:13,WHEC_JLewke,This sign seems to perfectly sum up the message of the #BLM protestors in #ROC today. @news10nbc pic.twitter.com/lCdBn5HhSy,"['#blm', '#roc']",32,0,14,PDT,,
944,2020-06-05 11:20:45,BillGiven,Racism is intolerable. We all have a role to play in ending it. I will be at the #BLM march in #GPab #YQU tomorrow. My statement below: pic.twitter.com/EHYGluhNYK,"['#blm', '#gpab', '#yqu']",38,3,10,PDT,,
945,2020-06-05 11:20:27,wassup_til,"I’m so happy to announce my acceptance to my first internship with a multi-billion dollar company! This is such an exciting moment for me and I’m ready for the new skills and experiences to come! ❤️
#BlackExcellence ✊🏽✊🏾✊🏿 #BLM  pic.twitter.com/xm9PbwXSCL","['#blackexcellence', '#blm']",138,3,36,PDT,,
946,2020-06-05 11:20:13,Jennmombomb,"So I’m at my mom’s house and we found out there was going to be a protest tomorrow here in town.  Great, I’m in!!!  That is until I found out the title “1st and 2nd Amendment Support Protest.”  Sigh....that’s not my lane right now.  My lane is 100% #BLM",['#blm'],18,3,1,PDT,,
947,2020-06-05 11:20:07,EmilyBarkiss,"THANK YOU!!!!

We just broke $1k in fundraising for #BLM?!?! 

If you’ve been looking for an opportunity to support, I’m still live with #RankedForRights on Twitch! @EmilyBarkiss","['#blm', '#rankedforrights']",18,1,5,PDT,,
948,2020-06-05 11:19:20,UnitedBlackOrg,"Today is #BreonnaTaylor’s 27th birthday. For those who dont know, Breonna was murdered in March by three officers who broke into her home and shot her eight times.  #BirthdayForBreonna @GovAndyBeshear @DrRandPaul @senatemajldr #BLM #BlackOutMonth2020  http://BlackOut2020.community  pic.twitter.com/sTFJbyKJGz","['#breonnataylor', '#birthdayforbreonna', '#blm', '#blackoutmonth2020']",14,0,12,PDT,,
949,2020-06-05 11:18:53,PynchonPod,"This should be obvious, but we at PIPCast do not support the fascist police state. Black Lives Matter. #BLM",['#blm'],37,0,4,PDT,,
950,2020-06-05 11:18:23,jackie70111,"This lady asks #blacklifematters...

Why isn't the #BLM movement in black neighborhoods, when
#Blacks are killing Blacks EVERYDAY⁉️

Watch this video...

#blacks4Trump
#KAG2020
#MAGA2020
#Trump2020
#AntifaTerrorists
#TakeBackOurCountry https://twitter.com/LegendaryEnergy/status/1268062728054177793?s=19 …","['#blacklifematters', '#blm', '#blacks', '#blacks4trump', '#kag2020', '#maga2020', '#trump2020', '#antifaterrorists', '#takebackourcountry']",48,4,36,PDT,,
951,2020-06-05 11:18:20,yoflvckoo,"Protest in Aliso Viejo, a city full of racist. Love to see it 
#BLM",['#blm'],17,2,2,PDT,,
952,2020-06-05 11:18:04,malikfoster_1,We in Dallas with it too #BLM 🖤🖤✊🏽  pic.twitter.com/yt5GjyM4jV – at Dallas Police Department Headquarters,['#blm'],19,0,4,PDT,Dallas Police Department Headquarters,
953,2020-06-05 11:17:32,Nick_Clamorgan,"The #BLM 's wettest dream.

...

 https://twitter.com/desossad/status/1267601240957038594/video/1 …",['#blm'],167,255,228,PDT,,
954,2020-06-05 11:17:25,djweissmann,Teaneck NJ #BLM protest  pic.twitter.com/tvgP4EYBPu,['#blm'],30,0,2,PDT,,
955,2020-06-05 11:16:48,Shlynn23,I’ve been donating money every time I sign a petition and I haven’t even paid my rent yet!💀 #BLM,['#blm'],19,0,0,PDT,,
956,2020-06-05 11:16:46,thatgirlmarian_,Join Washington State healthcare workers as they march against police brutality tomorrow morning! #blm  pic.twitter.com/XQlK4igCqw,['#blm'],226,5,80,PDT,,
957,2020-06-05 11:16:40,TittySandwiche,"#CubeSummer 2020

One week from today! A huge diverse group of artists coming together. A bigger better festival. Proceeds from my stream will go towards a #BLM fund.  pic.twitter.com/A7x79na8pf","['#cubesummer', '#blm']",30,3,11,PDT,,
958,2020-06-05 11:16:31,kalexander1012,She told him he was part of the problem & change was coming as everyone deserves & should be treated equally regardless of skin color. To say I am proud of her is an understatement. #BLM #ChangeIsComing (3/3),"['#blm', '#changeiscoming']",29,9,1,PDT,,
959,2020-06-05 11:16:17,jbcalton,"Incredibly proud of my classmates at the University of Arizona College of Medicine-Tucson and the staff at Banner University Medical Center for supporting White Coats for Black Lives earlier today. #WC4BL #BLM
📸: Dilara Onur, MS4  pic.twitter.com/vw4g3FFoT3","['#wc4bl', '#blm']",17,1,4,PDT,,
960,2020-06-05 11:15:14,jessicayflores,Dear @AOC. We know you you believe #BlackLivesMatter. It’s also important for us to know that the candidates who want to represent us also believe #BLM including Afro-Latinx. Will you endorse the most unapologetically outspoken candidate and ally in the AD34 race @votejgr today?,"['#blacklivesmatter', '#blm']",9,1,7,PDT,,
961,2020-06-05 11:14:50,cathalbrae,#LittleRock #education #blm Blocks and blocks of people behind me and blocks in front !  pic.twitter.com/VMJRgPj5kS,"['#littlerock', '#education', '#blm']",56,1,11,PDT,,
962,2020-06-05 11:14:41,SarahFraserShow,Look at my home state! #blm yassss Maine  https://twitter.com/JoshNBCNews/status/1268963799698157569 …,['#blm'],28,1,0,PDT,,
963,2020-06-05 11:14:39,DylinLofton,Shit really brings me to tears to see the sad reality of the world we live in today!😓thank you to the people to try and understand the #blm movement and educate themselves to become a better person. If you still have hate in your heart for any race you just have to be ignorant..,['#blm'],27,1,6,PDT,,
964,2020-06-05 11:14:35,brotakubaka,nothing makes me happier and feel more safe than seeing all my peers on the right side of history #BLM,['#blm'],12,0,3,PDT,,
965,2020-06-05 11:14:18,Imanimonsta,"This past week has seemed like the longest I’ve ever experienced. But I’m still thankful. My friends and peers have really shown out, having difficult conversations, educating others, and showing love to #BLM . Much love to everyone protesting, donating etc. ❤️",['#blm'],21,0,1,PDT,,
966,2020-06-05 11:13:39,B_4Lee,Dewine just announced he has plans for police reform. Further proof that the movement is working. Keep pushing. #BLM,['#blm'],20,0,1,PDT,,
967,2020-06-05 11:13:30,ManuZingar,"The ""just a few bad apples"" narrative is rapidly turning into an ""entire industrial scale orchard of putrid and rotted apples.""

The barbarism, brutality, sadism and sociopathic nature of police officers has been exposed. This is who they are, for their actions betray them. #BLM",['#blm'],60,1,9,PDT,,
968,2020-06-05 11:13:27,dontsithome,I joined the peaceful protest going on now in Hoboken. 👊👊🏻👊🏿👊🏾👊🏽👊🏼 @CityofHoboken @KenFerrante @RaviBhalla @HobokenPD  https://www.instagram.com/tv/CBD-Dv6n-6B/?igshid=jfa985y5yirr … #blacklifematters #blacklivesmatter #blm #hoboken #JusticeForGeorgeFloyd pic.twitter.com/slHWbSmovQ,"['#blacklifematters', '#blacklivesmatter', '#blm', '#hoboken', '#justiceforgeorgefloyd']",45,2,9,PDT,,
969,2020-06-05 11:13:21,beacarbone,"Protesting today in my white coat was important, but being at the statehouse regularly is also important, signing a thousand petitions and donating what money I can is also important. Change must come and no single element can outweigh the collective spirit of the movement #BLM",['#blm'],19,1,1,PDT,,
970,2020-06-05 11:13:09,WillyWonkaXRP,"Dear true #BLM people (citizens), NOT the political figure heads. 

The #AntifaTerrorists DO NOT care about BLM. They want to destroy our country. 

The MSM can’t be trusted. 

DO NOT destroy communities. 

Use social media to bridge communities and talk to one another. pic.twitter.com/Lg8zzDQN5R","['#blm', '#antifaterrorists']",25,3,6,PDT,,
971,2020-06-05 11:13:09,dammithaught,"March in support of #BLM and #GeorgeFloyd on the way to Stortinget (Parlament) in Oslo today

They are chanting 
"" Ingen rasisme i våre gater"" 
""No racism in our streets"" 

We all, internationally & US, have to stand together

#BlackLivesMatternorway
#blacklivesmatter pic.twitter.com/gbaAJNaOCL","['#blm', '#georgefloyd', '#blacklivesmatternorway', '#blacklivesmatter']",98,8,39,PDT,,
972,2020-06-05 11:12:27,Rob_Leitch,As we move forwards our actions will be more important than words but it is essential to begin with this clear pledge to our King Henry School community. We have a lot to do in our school & across the Odyssey Trust and that work is only just beginning. #BLM  https://twitter.com/KingHenrySch/status/1268957441053556737 …,['#blm'],19,3,8,PDT,,
973,2020-06-05 11:12:24,mle_ross,"just found out i’m not gonna fail my CS class :’)

with everything going on the past few weeks/months i was pretty worried bc my grade did not reflect my knowledge (i’m learning a ton!)...  just a small victory during a time of great sadness and anxiety ✨

more importantly: #BLM",['#blm'],24,1,0,PDT,,
974,2020-06-05 11:12:19,TKaraze,"Make a sign, find a busy street corner and position it for everyone to see (even if you’re alone). Any sign and anybody can help spread this message that #blacklivesmatter. To the man who gave me a thumbs down out of his window, please change your outlook immediately. #BLM  pic.twitter.com/5KL1AEtNlS","['#blacklivesmatter', '#blm']",14,2,0,PDT,,
975,2020-06-05 11:11:55,Sabrina_McDa,"#BLM

Trump declares 'great day' for George Floyd and equality.

He seems to have missed a key problem, regarding George's status and his ability to have great days ..  

#SayTheirNames","['#blm', '#saytheirnames']",50,10,15,PDT,,
976,2020-06-05 11:11:50,JaclynAlbin,Kneeling with our chapter of #WhiteCoatsForBlackLives #whitecoats4blacklives @UTSWNews in today’s event honoring George Floyd and so many others. #WeWillBetheChange #BLM  pic.twitter.com/gKYlBTavVJ,"['#whitecoatsforblacklives', '#whitecoats4blacklives', '#wewillbethechange', '#blm']",17,0,0,PDT,,
977,2020-06-05 11:11:19,balleralert,A young lady had #blacklivesmatter written on her back windshield and a man knocked on the door to tell her to get rid of it  #blm #georgefloyd pic.twitter.com/CxsMDmZLRG,"['#blacklivesmatter', '#blm', '#georgefloyd']",770,95,339,PDT,,
978,2020-06-05 11:10:59,ViDoubleNie,Earlier... Marched with protesters and fellow justices seekers in Hoboken #BLMprotest #BLM  pic.twitter.com/mYanImczqd,"['#blmprotest', '#blm']",6,1,0,PDT,,
979,2020-06-05 11:10:48,xavierholt_spt,White Coats for Black Lives. #blm  pic.twitter.com/JeeFeVF9V2,['#blm'],21,0,2,PDT,,
980,2020-06-05 11:10:42,alyyssasalazar,happy birthday breonna taylor. we want justice for you. #BreonnaTaylor #blm,"['#breonnataylor', '#blm']",16,0,9,PDT,,
981,2020-06-05 11:10:32,cjholloway21,"I don’t know who needs to hear this right now but if you are arguing #ALM over #BLM right now, you are wrong. Yes all lives do matter, but not until BLACK LIVES MATTER. If you don’t understand that, you are part of the problem. Don’t be ignorant.","['#alm', '#blm']",59,14,16,PDT,,
982,2020-06-05 11:10:04,leeszabz,I’ll be there. #BLM ✊🏼✊🏽✊🏿  pic.twitter.com/ivhwArxdI0,['#blm'],13,0,0,PDT,,
983,2020-06-05 11:10:01,Xavier_Holt,White Coats for Black Lives. #blm  pic.twitter.com/lLQMJgMpM8 – at Washington University School of Medicine,['#blm'],35,0,0,PDT,Washington University School of Medicine,
984,2020-06-05 11:09:54,MarkRangeI,"you the reason they even popped. Without you and your following, they’d be nothing. #BLM",['#blm'],21,0,0,PDT,,
985,2020-06-05 11:09:11,freeman13_s,People that think England isn't racist like America is crazy! Give English police guns and you stupid fools will understand #BLM,['#blm'],12,2,1,PDT,,
986,2020-06-05 11:09:05,maryamhaidar_,"#Iran has burned, drowned, tortured, put in cages like animals, refused to treat #Afghan Corona patients but they stand for #BLM rights?? Afghan suffering in Iran has always been overlooked. Our people are not safe anywhere","['#iran', '#afghan', '#blm']",268,8,116,PDT,,
987,2020-06-05 11:09:00,KINGSLEYxo,"Ready to stand with you 
✊🏿✊🏾✊🏽✊🏼✊✊🏻
#BLM  pic.twitter.com/aKWSTSwn6h",['#blm'],16,2,2,PDT,,
988,2020-06-05 11:08:24,abc7chriscristi,"#BREAKING: A palpable sight as hundreds of people march along Venice Beach, CA chanting “I can’t breathe!” and “No justice, no peace!” #GeorgeFloyd #blm @ABC7 #abc7eyewitness pic.twitter.com/QlcbWb9rra – at Venice Beach","['#breaking', '#georgefloyd', '#blm', '#abc7eyewitness']",332,16,136,PDT,Venice Beach,
989,2020-06-05 11:08:08,makewayforDRAY,"@DLMQN and I joined @UshmaNeill and staff and students outside Zuckerman this afternoon supporting #BLM
@sloan_kettering @GSKGradSchool @WeillCornellGS what polices/actions are being taken to address racism at an institutional level? pic.twitter.com/CYarhiqqg5 – at Zuckerman Research Center",['#blm'],25,0,6,PDT,Zuckerman Research Center,
990,2020-06-05 11:08:01,chriswatson187,"I missed the memo shifting us from #ClappingKeyWorkers to twatting them. What's wrong with people. I sympathise with #BLM But this is  
just a vehicle for a riot.  https://twitter.com/Michael_Heaver/status/1268281551462248449 …","['#clappingkeyworkers', '#blm']",19,7,2,PDT,,
991,2020-06-05 11:07:19,SamanthaLyynn,Some doctors are offering free healthcare to people who have been injured in the protests!! Please share!🖤🖤🖤🖤 #blm  pic.twitter.com/n8QzyYW84K,['#blm'],1262,4,428,PDT,,
992,2020-06-05 11:07:11,Loose_Lab_Rat,I no longer want to be a thoughtlessly progressive white female scientist who is and has been  part of the problem. #BLM #changestartswithme,"['#blm', '#changestartswithme']",28,0,2,PDT,,
993,2020-06-05 11:07:11,CoachDavePVAMU,"PVAMU WBB as we stand against social injustice ⁦@PVAMU⁩ ⁦@PrairieView17⁩ ⁦@COACH_S_PUGH⁩ ⁦@rhojacks⁩ ⁦@nuthnbutNETTE⁩ ⁦@PVAMUPanthers⁩ ⁦@theswac⁩ 

#BlackLivesMattter #OurLivesMatter #BLM  pic.twitter.com/uaDB9huCLI","['#blacklivesmattter', '#ourlivesmatter', '#blm']",28,1,12,PDT,,
994,2020-06-05 11:06:38,Uuey_E,"This shit gon go down in history look at my face in my image is slavery, God fearing I fear no man buh I know I’m black by the way that they aiming me #BlackLivesMatters #BlackTwitter #BLM #AfricanPride pic.twitter.com/OCpIfJInnV","['#blacklivesmatters', '#blacktwitter', '#blm', '#africanpride']",13,1,3,PDT,,
995,2020-06-05 11:06:09,StudioBrule,"Businesses are using ""Passover"" signs, ""Black-owned business,"" informing their new gods, Antifa & BLM, to pass them over in this plague of riots. Instead of the blood of a lamb they hope that sacrificing the white man to the mob will pacify their gods #BLM #AntifaTerrorists","['#blm', '#antifaterrorists']",102,14,32,PDT,,
996,2020-06-05 11:05:47,rachel_ohm,Update on what things look like now where #BLM is gathered. Quite a few more ppl than were here this morning. Border patrol though not pictured is also here keeping an eye on things.  pic.twitter.com/b9U5Diswfu,['#blm'],36,2,12,PDT,,
997,2020-06-05 11:05:36,MaxCollMD,"Thank you @DAbdelHameid @yssrasoli @rose_m_olson @NSpanosMD for organizing this powerful event against institutional racism and police violence. Thank you @valstonemd for your inspiring words as always, police violence is our lane. #bwhtakesaknee #BLM #WhiteCoatsForBlackLives pic.twitter.com/PR9tgx3GNK","['#bwhtakesaknee', '#blm', '#whitecoatsforblacklives']",17,0,2,PDT,,
998,2020-06-05 11:05:20,kambalu_s,Washington DC has never looked more beautiful! #blm  https://instagr.am/p/CBD8Y77FjF8/  pic.twitter.com/qa4zUeZqnX,['#blm'],10,0,1,PDT,,
